카페명,분류,주소,별점,별점페이지,별점갯수,리뷰
마레보비치호텔,"여관,모텔",제주특별자치도 제주시 애월읍 곽지1길 23,3.5,https://place.map.kakao.com/1051829610#comment,33,"[[5, '오션뷰가 매우잘보인다. 1층임에도 앞이 가려지지않고 탁트인뷰가 만족스러웠다. 내부시설은 깨끗하다고는 할수없지만 오래된 호텔이다보니 감안할만하다고 생각된다.'], [1, '난 아직도 여기에서 잃어버린 내 옷이 그립다. 직원들의 대처방식이나 불친절함이 아직도 생각난다. '], [2, ''], [1, '뷰는 정말 좋음.  현재 캠핑금지로 앞에 캠핑하시는 분들 없어서 좋음. 하지만 수건에서 냄새 베개에서 냄새남. 호텔 이용하면서 침대에 누워있는데 냄새 올라오는 거는 처음이였음. 또한 밖에 식당에서 노래를 너무 크게 틀어놔서 방 안에서 진동이 느껴짐. 대략 11시에서 12시에 꺼진 거 같음. 노래가 꺼지니 이제 옆방인지 주위 방에서 웃음소리가 다 들림.  방음 하나도 안됨. 아 마지막으로 화장실 문이 없었음. 뷰 하나만 보고 가기에는 좋음'], [3, '욕실이 어두운데 자세히 보면 검정 곰팡이 많다.\n뷰는 말할 것 없이 최고다만, 금액대비 과한 생각이 쪼곰 든다. 배달음식 가능한데, 회가 안된다고 하는디. 특별히 왜 안되는지 모르겠다. '], [3, '여느 국내 해변가의 소규모 호텔에 비해 고급스러운 인테리어컨셉과  서비스로 운영하는 호텔로 보입니다.\n전체적인 룸컨디션, 인테리어, 뷰와 간단한 조식 서비스, 그리고 특히 조식을 먹는 테라스는 좋은 기억으로 남았습니다. \n하지만 욕실의 욕조와 변기가 있는 공간과 세면대사이의 분리가 아쉽습니다. 원래는 유리 파티션과 유리 슬라이딩 도어로 되어있었던 것으로 보이는데 무슨 이유에서인지 지금은 샤워커튼으로 가려져 있습니다. 아무리 가족끼리지만 변기와 침실이 커튼 한장으로 가려져 있는건 좀 황당했습니다.\n또한가지 욕조의 수전이 샤워기와 수도꼭지가 같이 있는는 타입인데 샤워기를 위에 꽂을수 있는 걸이가 없습니다. 서서 샤워를 하려면 샤워기를 한손에 들고 샤워를 하던지 아니면 앉아서 샤워를 해야합니다.\n욕조 전용 수전을 설치해 놓아서 샤워하는 상황을 고려하지 않았네요.\n전체적으로 위치와 컨셉은 좋았으나 디테일이 좀 아수아누 호텔이었습니다.'], [3, '카페트에서 조금 충격먹었어용,, \n생각보다 스위트룸이 좀 좁구,,\n화장실은 모텔느낌으로 시컴시컴해요,,\n샤워기가 욕조 높이로 있어서 서서 씻으려면 샤워기 수전을 들고 씻어야해요 대략난감 ㅠ 뽑히려나 싶었지만 뽑히지 않네요\n건물 엘베며 좁고 눅눅하고 딱 모텔 같은 느낌이에요ㅜ\n통유리 창 장점 아니고는 40마넌 주고 여기 안올것 같아요ㅠㅠ \n'], [5, '오션뷰 보이는 숙소, 깔끔하고 넓은 욕실, 외관과 시설은 살짝 연식이 있지만 객실 안 기구들은 깔끔하고 깨끗하게 관리되어있고 조식도 정말 맛있고 조용하고 한적한 숙소로 딱입니다. 협재랑 애월 가기에도 편해요'], [5, ''], [1, '별한개도 아끼운 곳!! \n증거 사진찍어 올리려다 말았습니다. \n위생에 더 신경쓰주세요~ \n가시는 분은 이불 구석구석 잘 살펴보시고~ \n사장님~ 발 매트 구멍나고 찢어진건 버려주세요. \n아님 금액을 내려받음 되겟지만 지금은 넘 과하네요. 여기앞에 파는 수제버거집은 최고요~~^^'], [4, '조용하고 객실은 넓습니다. 다만.. 영업을 하는지 의심이 들 정도로 건물도 낡았고 주변도 휑하여.. 저희는 별로였으나 조용하게 머물기엔 좋습니다..'], [5, '위치, 시설, 조식, 뷰, 가격 모두 대만족'], [1, '체크인하는데 직원 한 명이 손님들 줄 세워놓고 하는 놀라운 시스템! 옆에 직원 다른일 하다가 급 체크인 도와주시 시작함...총 체크인 한 손님 8-10팀인데, 마지막으로 체크인 한 저희팀 16시 36분에 체크인 안내 시작함....^^ 조식 시에도 커피 아이스로 요청했더니 &ldquo;아침인데요...?&rdquo;, &ldquo;지금 좀 바쁜시간인데..&rdquo; 라고 하는 늙은 남자 사장님(?)으로 보이는 분..응대 클라스 ! 놀라워요. 마지막 체크인 날에도 캐리어 잠시 맡길 수 있을지 여쭤봤더니 우리 늙은 남사장님 &ldquo;안 됩니다&rdquo; 너무 단호해서 놀랐습니다ㅎㅎ 숙박업 종사하기에 딱 좋은 마인드입니다. 번창하세요~'], [1, '시설보통\n서비스 좀 기분나쁨 \n석연치않은부분이 많음'], [5, '매우 만족합니다. 바다뷰..정말 좋네요~^^\n호텔인테리어도 좋아요. 부띠끄호텔..\n그리고 호텔 로비에 카페도 매우 좋았어요.\n규모개 큰 체인호텔이 아닌데도 사장님이 정말 세심하게 신경쓰신 호텔이네요.'], [5, ''], [5, '완전 마음에드는 숙소였어요!\n항상 오션뷰 호텔을 찾았는데\n이만큼 좋은 뷰를 가진 호텔은 처음이였어요\n가성비 짱이였어요\n늦은시간 도착해 주차공간도 없었는데\n직접나와서 안내해주시고 룸도 업그레이드 해주셨어요\n다음여행지가 반대편이여서 돌아가야했지만 연박하고싶은 숙소예요\n잘쉬다갑니다 번창하세요'], [2, '전형적인 부띠끄호텔(모텔 상위버젼)로서\n다음은 리얼 체험 후기임..\n\n장점: 가성비, 도시적 디자인과 인테리어\n         1층에 레스토랑 겸 카페 운영(조식 가능)\n         1층 외 지하주차방 있음\n         곽지해수욕장이 코 앞, 사징님부부 친절하심\n\n단점: 방음 안됨(해변 떠드는 소리, 옆방 소음과 문닫는 소리, 옆방 초인종소리 ㅋ, 심지어 엘리베이터 멘트까지 다 들림;;)\nTV에 가로줄 심하게 생겼는데 안고침\n제일 심한점은.. 욕실임\n변기와 샤워룸 분리가 안돼있고 하수구 냄새가 났음\n특히 샤워할때 온수가 제대로 안나옴 ㅡㅡ;\n나오다 안나오다 좀점 심해져서 프런트 문의했으나 올라와 체크는 못해볼망정 보일러엔 문제 없고 많이들 쓰는 시간이라 그렇다 함(???)\n즉, 이곳에서 샤워 이용하실 분들은 다른 사람들이 많이들 안쓸 때 이용하면 되심'], [1, '체크인 30분 기다림. 식사도 기다림. 숙소에서 뭐 못먹게함. 파티 추천하면 절대 가지마세요. 위치빼면 시체. 가격대비 가성비 안좋으니 다른 곳 추천'], [5, '예약한 방이 없어서 스위트룸으로 업그레이드 해주셨는데, 너무 편하게 있다가 왔습니다. 방에서 파노라마로 보이는 해변가가 넘 좋네요. 주변 산책하기도 좋아요. '], [5, '객실 뷰가 좋아요\n조식도 1끼 15,000이면 적당! 맛도 있어요'], [1, '시설에 비해 가격이 너무 비싸고 패키지로 준 생맥주는 차갑지도 않고 밍밍해 먹어본 맥주중 최악이며 다시는 가고 싶지 않은 곳이다 차라리 서귀포나 제주시에 비지니스 호텔이 저렴하고 시설도 더 좋은것 같다'], [5, '객실 깨끗하고 뷰가 좋음 \n조식도 맛있음 \n직원분들 모두 친절'], [5, '객실 상태 좋고 \n뷰 좋고\n조식 좋고\n저녁에 와인 한 잔 하기에도 좋아요!'], [4, '객실 까끗하고 특히 조식이 감동이다.\n직접 만든 요리가 분명한 리조또와 직접 갈은 천일향주스와 직접 내린 커피가 일품이었다.\n직원분들도 친절하시고.\n좋은 조식으로 상쾌한 하루 시작!'], [1, '최악의 숙소 \n별 한개도 아까움!!\n\n룸에 들어갓는데 청소가 안되어 잇음 뭐 이거 까지 이해함 \n사람이니 실수 할수잇지요 \n(지네실수라 업그레이드 해준다더니 똑같은평수에 침대만 바꿔줌ㅋ \n우린 테라스때문에 여기 예약한건디 침대 올려주고 테라스 없음, 과연이게 업글?)\n\n같이 간 일행 씻으러 가고, 난 주차장에 물건 가질러갓다가 \n방에 못들어감 왜? 키가 안됨 ㅋㅋㅋㅋㅋㅋㅋㅋㅋㅋ 폰도 방에 두고 나왓고\n벨을 눌러도 안에서 씻고 잇는다고 못들음, \n\n혹시나 싶어 옆방에 갖다되니 열림 미친거지 ㅡㅡ (안에 짐만잇고 사람없엇음)\n어이털리고, 소름 돋음 옆방사람도 지네방 안열린다고 우리방 열엇음 ㅋㅋ 생각만해도 와 아찔함\n따지러갓더니 방이 없다고만 함 어쩔수 없이 잣지만 진짜 욕나옴\n이중잠금은 안되는걸 왜 달아놧는지 모르겟음 \n\n여기 후기는 다 좋은거만 있어서 낚임 \n무조건 검색창에 따로 후기 찾아보고 가야 됨  '], [5, '위치 좋구요\n방 인테리어도 괜찮았고\n아침 조식도 나쁘지 않았어요\n가성비 좋아요'], [5, '곽지과물해변 바로 앞이라 제주서쪽여행할때 좋은위치의 숙소. 엄마랑 같이 여행하면서 스위트룸 묵었는데 객실상태 청결하고 넓고 편하게 있다왔어요. 가족단위로 놀러온다면 이 숙소 강추! 직원분들도 모두 친절하시고 로비 분위기 좋아요!'], [5, '곽지해변의 아름다운 뷰와 어제 그제 묵었던 5성급 보다 맛있는 조식과 (애월 지역의 농축산물의 신선하고 맛있는 조식), 서비스~\n아이와 아내와 짪지만 편안히 머물다 갑니다\n다음에는 최소 2일 이상 머물러야 겠네요~^^'], [5, '처음으로 가는 제주여행이었는데 정말 처음부터 너무 좋은 호텔에 숙박하게 되서 행운이었어요~ 생각도 못한 룸업그레이드로 친구들과 좋은 추억을 만들수 있었습니다^^ 밖에 풍경도 좋고 생맥주도 맛있었고 조식 먹을때 직원분이 하나하나 설명도 잘해주시고 친절하셔서 식사도 맛있게 잘 먹었습니다.!! 다음에도 제주여행 오게되면 여기서 꼭 숙박 할 생각입니다^^'], [5, '여기 정말 이돈주고 이정도면 많이 훌륭합니다\n해변가 바로앞이라서 더욱 좋아요\n친절하시고 최신시설에 깔끔합니다\n\n에이스침대최고에요~\n조식도 특히 커피도 토마토쥬스도 모두 좋아요\n\n3박있는 동안 너무 좋았습니다\n\n다음에 또 들릴께요~\n'], [5, '조식 주고 새 시설에 이정도면 훌륭합니다'], [2, '방이 생각보다 작음\n스태프 불친절 \n호텔아니고 모텔 느낌 더 정확\n침대편하고 화장실 깨끗 (하지만 화장실 문이 닫히지 않았음)\n\n좋은 점: 바다가 보임.']]"
제주엘루이호텔,"여관,모텔",제주특별자치도 제주시 서광로21길 1,3.5,https://place.map.kakao.com/11104419#comment,6,"[[4, '평일저녁에 잠만 자는 용으로 1박을 했는데, 층간소음은 조금있긴한데 신경쓸정도는 아니었습니다. 리모델링을 한지 얼마안되어 보이는 깨끗한 방이었습니다.\n\n불편했던게, 침대가 소리가 좀 크게 났었구요.\n화장실하고 방사이가 다 현관이어서, 화장실갈때 넘어다녀야 했습니다. 그건 현관을 절반정도 쪼개서 화장실가는 마룻바닥을 만들면.좋을거같아요.'], [5, '주변이 조용하고 시끄럽지 않아서 잘 쉬었네요. 침대는 푹신한 침대는 아니었는데 엄청 편했어요.. 아주 잘 잤습니다. (머리카락 1개 보이더군요.. 그거 하나 외엔 못봤습니다.) 혼자 쉬다 가기 좋은 호텔입니다. 연휴라 그랬는지 조식서비스는 없었네요.'], [1, '오래된 모텔이고 \n방도 습하고 방음 전혀안되요 문도 열쇠문에 잘 잠기지도 않아요.\n깔끔해보이는 사진에 속았네요 너무 별로에요 \n주변은  유흥업소고  정말 1점이 아니고 별 반개 수준 입니다.'], [5, '가성비 너무 편하게 있다갑니다. '], [5, '가성비짱!터미널근처이고 시내권이라 이동이 편함'], [1, '남편 출장이라 따라갔지만\n첫방에 곰팡이 냄새 ㅠㅠ\n화장실 벽 곰팡이 냄새\n\n그나마 바꿔준 방은 괜찮았지만 \n화장실 곰팡이가 ㅠㅜ\n'], [4, '무난함 다만 화장실에서 물냄새가 남\n대신 동부 야시장 가기 편함']]"
신신호텔 서귀포점,"여관,모텔",제주특별자치도 서귀포시 태평로371번길 18,3.9,https://place.map.kakao.com/163760224#comment,34,"[[5, '깔끔하고 쾌적해서 좋았어요. 다만 장기투숙객이라면 숙소에  전열기구가 없으니 조리  불가하다는거 알고 오세요.  외식하실 분은 상관없겠지요. '], [5, '37000원에 5성급 시설의 호텔에서 묵을 수 있는곳\n세탁기도 있고 냉장고 크고 냉기빵빵, 빌트인 에어컨도 깨끗 하고 성능좋아요!!\n직원 분 친절하고  룸 업글도 해주셔서 오션뷰에서 묵을수 있었습니다 주차공간은 협소하지만 2인실 2인실 정말 강추하고 싶은 곳입니다'], [4, '가격대비 깔끔하고 밝아 괜찮음\n비싼호텔과 비교하면 안됨\n하지만 이 가격인걸 감안하고 보면\n방도 깨끗하고 좋았음'], [1, '1. 직원 툭명 스러움(친절도 ⭐️⭐️)\n     교육이 재대로 되있나 싶음..\n\n2. 객실은 깨끝하나 옆에 짓다가 폐업한 건물이 떡한이 보임 ( 그많은 빈방을 두고 여기를 왜 줬나 싶음)\n\n3. 1층에 직원이 자주 자리를 비움 안보임 어디있는지..\n\n4. 직원들 간에 소통이 안되나?!\n      방을 예약하고 들어갔는데 너 왜 허락없이 거기 입실해서 있냐 하는식으로 문의가옴 (황당함 내가 열쇠를 훔처서 들어왔을까?! ㅎㅎ)\n\n5. 칫솔, 면도기, 등등 천원주고 사야함\n\n6. 저렴함\n\n7. 친절 기대하기 어려움\n    (직원에따라 다른건지 잘 모르겠음)'], [3, '호텔로서의 기본적인 구색은 갖췄다. 나쁘지 않았다. 세탁기가 있다는 것도 무시할 수 없는 장점이다. 건조기능은 없지만 방에서 말리면 되니 문제될 것이 없는 듯 하다. 또한 서귀포 구시내에서 숙박만 저렴하게 할 경우 가성비면에서 좋다. 다만 와이파이 상태가 최악이다. 켜져있기만 할뿐 인터넷 연결이 안 되어서 사실상 사용할 수 없는 상태였다. 셋톱박스를 껐다 켜도 소용 없었다. 방마다 상태가 다를 수 있겠으나 예전 리뷰에서도 이런 내용이 있는 것으로 보아 적어도 어떤 방에서는 와이파이에 심각한 문제가 있는 듯 하다. '], [5, '가격대비 완전 좋앟어요!\n객실도 화장실도 깨끗하고\n올레시장 가깝고 ㅎㅎㅎㄹㄹ\n만족합니당 '], [4, '전 세탁기 하나땜에 이곳을 골랐습니다.\n제 여행에서 숙소란 잠만 자는 곳이기 때문에 ㅎ..\n올레시장 걸어다녀오기 좋고 \n저는 협재에서 신나게 물놀이하고 옷 그대로 입고 숙소와서 씻구 세제 챙겨와서 옷 빨았어요 ㅎ-ㅎ \n여기는 경차랑 suv는 주차타워 이용 못합니다. 일반 주차공간 만차면 외부 이용하셔야해요! 깔끔하진 않지만 저처럼 세탁기와 잠만자면 된다 주의시라면 추천드려요'], [2, '그냥 평범한 저가형 숙소이다. 딱히 냄새나거나 청결에 문제는 없다. 오래되진 않은 듯 하다. 뒤에 건물이 건설중이라 뷰가 쒯이다.'], [5, '깨끗하고 쾌적하게 잘 잠 세탁기가 있다는게 최고'], [4, '주차장 문제가 심각한 것 같음\n뚜벅이로 가면 아주 만족스러운 호텔\n위치도 괜찮고 깔끔함\n창문 바로 맞은편에 다른 건물이있어서 커튼 치고 살아야함\n어쩌피 잠만 자서 아주 만족했음~~'], [1, '해당 호텔에서 숙박한 5박 내내 외부 주차장에 주차를 해야 했습니다. (지하주차장 공간이 부족해서 일찍 들어와도 외부 주차장에 주차하라는 안내 받음.) \n4일 차 아침 주행 전 타이어 문제를 확인했고 보험사를 부른 결과 주차 중 칼날에 의해 펑크 된 것 같다고 말씀하셨습니다. (외부주차장에 못&amp;쇠조각이 많고, 주행중에 펑크가 났다면 아예 깊게 박혀 보이지 않았을 것이다 등 이외에 여러 정황 고려하셔서 말씀하심.)\n\n따라서 4일차 오전 일정을 모두 취소하고 책임자라는 프론트 남자 주임에게 상황을 전달한 결과 호텔 측 책임이라는 정확한 증거가 없다는 답을 얻었습니다.\n\n외부주차장에 cctv도 없고, 직원들도 주차장 바닥 상태 모르고, 사고나니 외부주차장은 대여한 땅이라는 이상한 논리 자체가 이해가지 않았습니다. \n\n호텔측에서 수리비 배상은 했지만\n&quot;외부 주차장에 cctv나 위험성 안내문구도 없다. 못믿겠으면 주차장가서 바닥 확인해봐라.&quot; 라는 저의 말에 갑자기 &quot;자신을 무시한다. 본인은 좋게 해결하고 싶은데 이런 식이면 그럴 수 없다.&quot; 라는 급발진하는 남자 주임 말이 잊혀지지 않네요.. \n\n이게 사실 문제이지, 왜 프론트 직원과 고객의 감정 문제 입니까? (..할많하않)\n\n책임자라고 와놓고 한숨이나 쉬면서 끝까지 사과나 공감은 전혀 없었고, 팩트체크에 대한 대답도 제대로 하지 못하는 응대방식에 ptsd 걸릴거 같아서 여행 일정 단축 수정해서 돌아왔습니다..\n\n잠만 자고 나올거라 리뷰 잘 안보고 호텔인줄 알고 갔다가 기본적인 서비스도 못하는 직원이랑 감정적 소모만 엄청한 아주 값진 경험했네요...'], [4, '구ㅡㅡㅡㅡ웃'], [5, '여기  꼭방문하세요   야놀자보다 더싸고  컬리티는 너무좋음 \n첫날 제주시 16만원짜리보다  더만족함'], [4, '숙소가 너무 예뻐요ㅜㅜ\n근데 테이블이없어서 캐리어 눕혀두고 바닥에서 먹었네요\n그리고 너무 추웠어요ㅠ\n주차는 맞은편 오션펠리스 호텔에서 하면되는데 여기도 조금 불편했어요...'], [5, '다음에 서귀포에 묵으면 꼭 재방문할 숙소'], [5, '일단 프론트직원분이 세상친절하시고 저희는 더블예약했다가 트윈베드있는곳으로 업글시켜주셨는데 침대때문에 테이블이용이 어려워서 말씀드렸더니 더블로 다시 바꿔주시고 센스있게 의자까지 추가로 갖다주셨어요ㅜㅜ 직원분이 너무 친절하셔서 아주 기분좋게 이용했어요☺️\n보통 호텔테이블은 작아서 뭐먹기 어려운데 여기는 오피스텔형태라 테이블이 넓고 공간활용이 잘되어있어서 진짜 편하게 잘 있다갑니다! 다만 화장실에 머리카락, 먼지가 좀 있는편이고 바닥에서 체모를 봐서 위생은 조금 아쉬웠어요, 그치만 크게 예민하신편아니면 가성비숙소로 추천드립니당! 아그리고 맞은편에 다른 호텔이있는데 서로 너무 잘보여서 건너편분과 눈마주치고 서로 커튼쳤습니당ㅋㅋㅋㅋ'], [5, '가성비로 이만한 호텔이 있을까\n그냥 너무 좋은 곳이고\n직원도 너무 친절하다.\n뜻밖의 만족에 연박하고 갑니다.\n따-봉'], [4, '깔끔하고 세탁기에 큰 냉장고도 있어서 편해요 그리고 올레시장이랑 굉장히 가까워서 좋아요 방 자체도 넓은 편이라 좋은데 와이파이가 별로라 자꾸 인터넷 연결이 끊겨요 ㅜㅜ 코로나 때문에 맞은 편 오션팰리스 호텔에서 조식 이용해야 되는데 가격 대비 굉장히 먹을 게 없어요...'], [4, '가성비 좋은 호텔~ 깨끗하고 직원분들 너무 친절하시네요~ 세탁기도있음. .위치도 좋은데 흠이라면 주차장이 좀 협소해요..바로앞 호텔이 자매호텔같은데라 주차장이용하게 되는데 거기도 늦은시간 도착하면 많이내려가고 자리찾기 쉽지않아요~ '], [4, '직원 친절했고 방도 괜찮았음\n아쉬운점은 방 앞의 골목 소음이 그대로 방에 들어오는것 같음\n'], [1, ''], [5, '깨끗합니다 '], [3, '후기가 호불호가 강해요 걱정했지만 장단점이 뚜려한 곳이었어요! 필요에 따라서 선택하시면 될것같아요 다만 가족단위 4명이라면 협소해요 친구랑 오는 가성비숙소를 찾는다면 굿\n장점\n신축 오피스텔 편리성\n앞에 편의점 가깝고 서귀포올레시장이랑 차로 10분거리\n빌트인냉장고와 넉넉한수납공간,싱크대,비데,lg천장형에어컨,트롬세탁기\n단점\n주차공간협소\n'], [4, ''], [5, '가성비 갑! 깨끗해서 기분좋았어요\n방도 업그레이드 해주셨네요 ~~'], [1, '별루..쓸데없는 수납공간이 너무 많아 공간도 좁고..그냥 모텔 수준..\n두팀이 갔는데 다른 한방은 창문도 못열고. 열어보니 건물을 짖고 있어서 어둡고 \n그런 방을 제값받다니..조식은 너무 성의없고 요리하는 아줌마인지..먹는걸 쳐다보고 있어서 부담백배..\n쥬스는 상한건지..먹다가 막걸리 쉰맛으로 다 버리고 왔음...서비스 개판.\n사진을 찍었어야하는건데 \n주차장도 좁고 부족해서 앞건물 주차장에 주차해야하고\n뭐 한개라도 맘에 드는것이 없었음'], [5, '생각했던것보다 훨씬 괜찮은 숙소네요.\n이중섭거리랑 올레시장 가까운것도 장점입니다.'], [5, ''], [2, ""오션뷰..라고 적혀져있었는데 제가 생각하던 오션뷰는 전혀 아니었어요. 바다'만' 보이면 오션뷰인지 너무함ㅜㅜ.. 시설도 막 좋은건 아니고 방이 넒지도 않았음. 여행하시는 분들이 찾으실 곳은 아닌것 같아요""], [5, '위치좋고\n깨끗하고\n저렴하고\n다~ 좋았어요'], [5, '좋아요. 아주 만족스러웠어용. 위치도 중심지라 주변에 뭐 많았어요. 공차 엽떡 그리고 시장까지. 약간 호텔보다는 그냥 오피스텔 느낌이었는데 저는 만족했습니당.'], [5, '왜 낮게 평가하는지 모르겠네요\n신식 오피스텔 그자체입니다. 단지 주차장이 협소할뿐. 그래도 앞 건물에 주차가능해요'], [5, '잘 지냈습니다. \n6박하면서 이쁘고 멋있는 올레길5,6,7코스 완주했고요.\n직원분들 친절하시고 시설 깨끗하고 좋아요.\n호텔 주변 관광하기도 좋고 올레시장 가까와서 더좋고... \n단점은 바로 붙어서 신축 건물 공사중이라 시끄러운게 있어요'], [5, '가격대비 최상급 퀄리티에 최상급 건물, 위치도 좋습니다. 방음도 잘되는편인데 다른 리뷰보면 왜 이리 두들겨 점수로 두들겨 맞았는지 모르겠네요. 방 바이 방인가?'], [1, '관리가 잘  안되는것  같아요!  오피스텔형인데 수납공간에  누가 입었던 팬티, 양말 더럽게 그대로 있었습니다. 이야기해도 치워줄 생각은 없고 죄송하다고 합니다.  비바람 부는날인데  주방 배기구 후드에서 계속 심하게 소리가 나는데  한잠도  못 잤습니다.  블랙컨슈머는 아닙니다. 여행갔는데 오히려  스트래스 받아 힘들었습니다. 너무 심하게 관리가 안되는것 같습니다. ']]"
