카페명,분류,주소,별점,별점페이지,별점갯수,리뷰
라마다프라자 제주호텔,특급호텔,제주특별자치도 제주시 탑동로 66,3.7,https://place.map.kakao.com/15292731#comment,72,"[[5, '친절하고 깨끗합니다. 특히 지갑분실했는데 바로 연락오더군요. 너무너무 고맙고 여행 즐거웠습니다.'], [4, ''], [1, '미국에서 평점 4.3에 5star hotel 이라고 되어있는 구글 리뷰만 보고 방2개 예약해서 간건데, 여기 리뷰와 다른 리뷰를 확인하지 않았던걸 후회했읍니다. \n일단 호텔 전반적으로 청소상태가 별로 좋지않아서 있는 내내 안좋았읍니다. 방 2개 다 화장실 청소가 제대로 되어있지않았었고, 침구도 냄새가 별로 좋지않았으며 너무 시끄러웠읍니다. 기대하고 간 식구들에게도 너무 미안하고, 다시 가고싶지않네요.'], [1, '여기는 쇼파에\n뭘뿌리길래 이렇게 독한거죠 ㅋㅋㅋㅋ \n기껏해야 한시간 남짓 앉아있었는데 그모양 그대로 접촉성피부염 나서 지금 일주일쨈데 아직도 저래요 참다참다 올립니다. \n방에서 찌린내가 나서 다시 청소를 부탁했는데도 엄청나네요.! 공짜로 가라고해도 다신안갈거같아요 '], [1, '별 한개도 아까워요\n방 들어서자마자 악취가 진동해서 룸체인지 했어요\n방향제 잔뜩 뿌려 놨더라구요\n샤워실 타일 사이 더러워서 정말...\n특히 수영장은 타일 사이 물론 더럽고 초록색 곰팡이까지 있어요\n수영장 바닥은 또 어찌나 이물질이 많던지\n동네 시립 수영장이랑도 비교됐어요'], [4, '객실상태 괜찬았어요.'], [1, '밤 10시까지 10분간격으로 전쟁나듯 비행기 뜨는 소리에 돌아버림 스트레스 열빵 받고 정말 후회 됨 다시는 안갈거임'], [5, '다른건 모르겠고 조식뷔페는 끝내줘염'], [2, '리뷰보고 걱정했던 비행기소음은 창문만 닫고 있으면 거의 안들림.\n다만 룸인테리어는 정말 불호.\n욕실과 룸사이에 구멍숭숭뚫린 창을 내놔서 화장실 일보는 소리며 씻는 소리가 여과없이 방안으로 다 들어온다. 수건도 작은 수건 큰 수건 달랑 2장씩.\n수건걸이 위치는 왜 세면대 밑에 고리형태로 달아놓은건지...\n욕실 청소도 하다만건지 바닥에는 전 투숙객 머리카락. 욕조에는 얼룩.'], [5, '연식 대비 룸이 넓다 직원들 엄청 친절하고 위치도 좋아서 재방문 하게 만드는 호텔임 다만 화장실 방음은 노답 ㅠㅠ 화장실문이 의미가 없음 편하게 대화 가능함 ㅋㅋㅋㅋ'], [1, '스위트룸에서 묵었는데 모텔인줄\n분명 전체 금연이라고 했는데 전체 흡연인듯 ㅎ\n방에도 담배 고인 냄새가 나고 고지를 제대로 안 하는지 매일매일 객실에서 담배피는 냄새가 올라옵니다...^^ 전반적으로 건물이 낡아서 환기 자체가 안되는건지...\n아이들이나 임산부 분들이 투숙 고민하시면 말리고 싶어요 ㅎ \n오션뷰 빼면 걍 장점이 없음'], [1, '진짜 최악의 호텔. \n\n1. 쉬러왔는지 비행기소음 청음하러온지 모르겠음. 심지어 밤임.\n\n2. 4인용룸에 변기 한개임. 더빡치는건 화장실 모든문에 가로로 구멍숭숭뚫려있고 방이랑 공기가 매우잘통하여 *배변소리 매우 잘들림*\n\n3. 에어컨 고장남ㅋㅋㅋㅋㅋㅋ  온도조절장치는 있지만 *온도조절은 절대 안되니* 기대ㄴㄴ\n\n장점 단 하나. 로비피아니스트 매우 인상적이었음.\n\n평생 쳐다도 안볼 호텔. 5성급은 개나소나인가'], [2, '외부보다 실내가 외국 유람선 느낌으로 이국적이고 멋져요. 방 배정이 별로 였는지 303호는 엘리베이터 타는데 한참 걸었고 스파랑 연결도 어려웠고 룸은 오션뷰라 나름 좋았지만 화장실이나 샤워부스 등 노후된 부분이 많았습니다. 무엇보다 ㅠ 비행기 이착륙 소리와 1-2층 아래 분수 소리에 전쟁난듯 시끄러워 밤새 잠을 못자는ㅜㅜ 저희는 다시 투숙하진 않을거 같아요 . 아 사우나는 진짜 비추요 ㅠ \n'], [4, ''], [1, ''], [5, '제주 신행 6박 7일 간 가장 좋았던 숙소. 다른 호텔 및 감성숙소들보다 훨씬 좋았다. 노후됐다는 평이 있지만, 이정도 연식에 이렇게 관리가 잘 되어있다는 것에 오히려 더 만족스럽고, 무엇보다 처음에 잘 지어놨는지 무지 따뜻하고 편하다!! 이용자의 편의를 위해 만들어진 듯 한 룸 인테리어와 컨디션 모두 너무 만족, 조식도 최고!! 게다가 가성비까지..!!!!'], [4, '서비스, 룸컨디션 다 만족하지만, 수영장 카운터 직원(안경쓰신 아주머니)은 정말 불친절함.. 마감 1시간 전에 수영하러갔다가 짜증내는 얼굴로 응대해서 굉장히 불쾌했음.. 사우나쿠폰있었는데도 안하고 그냥 나왔음..그래서 별 4개.. 안내데스크 직원은 정말 친절했음..'], [2, '지하주차장에서 객실 올라는데 엘레베이터 두번 갈아타야 됨.\n엘레베이터도 작아서 퇴실시간에 난리.'], [5, ''], [4, '조식맛집\n룸은 냄새나고&hellip; 올드했음 \n수영장은 괜찮았음 ! '], [5, '제주시내에서 꼭 가볼만 한곳'], [5, '여러방면에서 다 좋아요. 자주 이용합니다.'], [5, ''], [5, '여기 밥맛짱'], [4, '로비가 매우넓고 ㅁ 자로 객실이 구성되어있어 개방감이 좋습니다.\n바닷가 오션뷰가 좋고, 비행기가 자주다녀 보는맛이있음.\n로비중앙에서 피아노연주를 밤마다하는데, 들을만함.\n객실이 넓고 화장실이 넓은데 낡은티가ㅡ납니다\n객실은 카페트 바닥. 객실슬리퍼는 가죽 슬리퍼\n\n룸서비스로 시켜먹는 음식들 맛과 가격이 괜찮구요.\n조식은 2만원대 가격대비 괜찮습니다.\n\n호텔이 완전 제주시내에 있어, 차가 많아서 어디다녀올때 은근 시간이 많이걸립니다.  끝.'], [3, '뷰도 좋고 놀기도 좋고 밥도 맛있는데 서비스센터 할아버지 진짜 불친절... 길 잃어서 여쭤봤는데 대답도 안하고 나가라고 손으로 휘익 휘익 내젓기만함...'], [5, ''], [4, '노후된것은 클래식한 맛으로 즐겁게 지낼 수 있는데 주차장이 너무 좁고 &lt;방지턱이 너무 많음&gt;'], [1, '청소 상태 엉망. '], [5, '룸은 노후되서 아쉬워요. 그런데 직원분들 응대가 뛰어나고 오션뷰가 진짜 좋아요. 주변 가까운데 맛집도 꽤 있어서 편했습니다.'], [2, '직원들은 매우 친절하나 그게 커버되지 않을만큼 시설이 매우 노후됨. 비싼 돈 주고 왔는데 그냥 돈 좀 더 주고 해비치 갈걸 하는 생각함. 룸 컨디션 중요시 하는 사람은 매우 실망할 것(심지어 콘센트 마감... 말잇못). 공항 근처라 비행기 뜰 때마다 소음이 심함. '], [3, '겉은 화려\n속은 여인숙\n\n하지만 헬스장은 준수\n\n\n헬스를 좋아하는 사람에게는 추천\n\n룸컨디션을 중요시하게 생각하는 사람은 실망할것같네요'], [5, ''], [5, ''], [5, ''], [5, '서비스도 내부도 너무 좋음... 좋아여'], [5, '위치 좋고 이국적인 분위기와 꽤 좋은 룸컨디션. 오션뷰가 확실하게 오션뷰라 좋았습니다. 이곳에 묵으신다면 석식 뷔페 필수입니다. 각종 해산물이 나옵니다.... 정말 맛있고 신선했어요. 이것 때문에라도 다음에 또 가고싶어요. '], [1, '내인생 최악의 호텔 돈 좀 더 주더라도 다른 곳으로 가세요.\n\n1. 객실내 담배냄새와 싸구려 방향제 냄새\n2. 수영장 헬스장 1박에 1회만 사용 가능\n3. 수영장락카에서 발냄새 비슷한 냄새 진동, 머릿카락 수북함. 가보고 아이를 수영장에 데려가지도 않음\n4.부페는 두번 먹을 곳 아님\n5. 서비스도 5성급 호텔이라고 보기 어려울 정도임\n6.이호텔은 중국인 단체 관광객을 위한 곳이라고\n보면 됨.'], [4, '더블루 조식 유아식탁 매우 만족.\n냉장고 문이 잘 안 닫힘.\n위치 선정이 좋음. 바로 옆 이마트, 근처 동문시장 등'], [5, ''], [4, '해변걷기좋음'], [5, '좋아요'], [4, '가격대비 괜찮아요\n시설은 오래되었지만 넓고 좋아요 \n\n아쉬운 점은 객실층에서 주차장까지 바로 가는 엘리베이터가 없다는 점... \n넓은만큼 객실이동하는 엘베랑 지하주차장 가는 엘베랑 거리도 멀어서 번거로웠어요\n\n비행기소리는 그닥 거슬리지 않았는데.. 호텔측에서 하루종일 음악을 틀어주십니다.. 제발 노노노노 ㅠㅠㅠㅠ다른 투숙객들은 컴플레인을 안하나 ㅜㅜㅜ'], [5, '올드하지만 청결하고 객실이 넓어요. 침구 진짜 편함. 조식도 괜찮아요.'], [1, '라마다 호텔 처음 묶었는데\n진짜 몰랐네요 이렇게 오래된 호텔인지 ...'], [1, '제주도 내 최악 중의 최악 호텔. 시스템 오류로 중복 예약 되었는데, 취소 수수료 받고. 숙박 금액이 무슨 코인처럼 실시간으로 변함. \n호텔 내부는 더러운 것 뿐만 아니라 너무 노후되고, 주위는 인천 부두가 같음'], [4, '좀 오래되긴했는데 객실도 넓고, 직원분들도 친절함'], [4, '2008년도에 와보고 2021년에 다시와보네요~~ 저엉말 클래식한 느낌 그대로입니다 홍콩 호텔같아요!! 서비스 정말 좋고 위치 너무 좋아요!! 연식을 무시하진 못하는게 살짝 아쉬워요'], [3, '주차장이 좁아서 비오는 날... 뒷편 야외주차장에 세워놓고 비를 쫄딱 맞았다. 객실은 좁아도 너무 좁다.(다른지역 라마다도 다들 좁다.) 좁지만 비교적 깔끔하지만.. 심각한 담배냄새가 괴로울 지경이다. 호텔직원들이 어찌 해줄 수 없는 문제라 더윽 괴로웠다..'], [4, ''], [5, ''], [5, ''], [5, ''], [5, '가족끼리 왔다가 새해부터 이틀동안 너무 좋은 방에서 즐거운 추억 많이 만들고 갑니다. 다음에 또 제주도 올 때 숙박하겠습니다.'], [4, '온돌룸 너무 옛날 우리집 같아서 편했음\n\n문제는 너무 우리집같아서 여행 온것같지않음 ㅋㅋㅋㅋㅋㅋㅋ\n\n조식 굿'], [5, '좀 오래됐지만 좋았어요\n특히 침대가 너무 푹신했어요'], [3, '전망 좋음\n직원분들 친절함\n공항 가까움. \n침구류 만족\n\n청소 불만족\n칫솔 치약 유료\n비행기소리는 어쩔 수 없음\n'], [5, '좋습니다'], [4, '침대가 완전 편해서 꿀잠 잤어요. 그런데 화장실 환기가 잘 안되네요'], [3, '장점\n1.일단 오션뷰로 전망하나는 끝내줍니다.\n2.침대 크고 적당히 푹신하고 너무 좋아요.\n3. 직원들 매우 친절함.\n단점\n1.오래된 호텔이라해도 5성이라는 명성에 맞지 않게 너무 시설이 오래됨. 샤워시설, 냉장고 개선 필요.\n2. 잘 눈에 띄지 않는 곳의 청소 미흡. 샤워기 호스에 곰팡이, 환풍시설 곰팡이, 심지어 식품보관 용도인 작은 냉장고에도 곰팡이.. \n3. 공항에 가깝다 보니 가끔은 비행기 소리가 너무 크게 들림.. 잘때는 어차피 비행기 안뜨는 상관은 없지만. \n\n총평. 단점만 보완되면 다시 찾고 싶네요.\n\n참고. 618호 이용 후기 입니다.'], [5, '조금 오래 됐지만 뷰도 좋고 괜찮아요'], [2, '특급호텔의 명성으로 음식의 퀄리티는 그다지'], [4, ''], [4, '뷰도 괜찮고 시설도 나쁘지 않았어요'], [4, '시설보다 뷰 때문에 다시 찾은 곳\n탁트인 바다 보니 가슴이 뻥 뚫이네요\n아이들도 너무 좋아하고 \n주변 먹거리도 있어서 좋았습니다'], [4, '시설이 살짝 노후화 되어있고 환기가 잘안되는거(1로비에 음식냄새가 위로 올라와서 문을 열면 냄새가 나요 ㅠㅠ 2 화장실 환풍구가 없어요..ㅠㅠㅠ  ) 그래도 직원분들이 다 친절해서 좋았습니다.'], [3, '그냥 무난한데 화장실의 모든 소리가 차단이 안되어서 룸에서 모든 소리가 들려요. 그 반대도 마찬가지. 좀 러브호텔인가 싶었음. '], [4, '실내수영장이 수영하기 좋습니다\n수질 수온 관리상태 다 좋구\n25미터 레인 4개있는데 2개는 회원전용이라\n투숙객은 2개 이용할수 있습니다\n1개는 물놀이레인이 돼버리니\n사실상 수영인을 위한 레인은 1개입니다.\n추석연휴에 3박 묵었고 수영장 3일 이용했는데\n널널해서 접영도 맘껏할수 있을 정도 였습니다\n.\n성수기에는 투숙객레인 두개를 합치는 만행으로\n두 레인 만큼이 모두 물놀이판이 되서\n수영을 할수 없는 상황일때도 있다고 합니다\n.\n시티뷰였지만 시야를 가리는게 없어서 괜찮았습니다\n콘센트가 부족한편이긴 했지만 크게 불편하지 않았습니다\n전반적인 룸컨디션 만족스럽고 샤워기 수압도 좋고\n무료와이파이 상태도 괜찮았습니다\n(다만 크롬캐스트 연결은 불안정했음)\n치약 칫솔은 미리 챙겨가시면 좋습니다\n조식도 괜찮았는데 과일쪽은 좀 아쉽습니다\n.\n재방문의사 있고 버스로 여행하기에는\n어디든 한번씩 환승을 거쳐야 하는 위치라서\n걷기에도 애매한 거리이고 그렇습니다\n가까이에 마트 편의점 쏘카도 있고\n바로 뒤는 바다옆 산책로입니다'], [3, '침대는 진짜 좋아서 잠 잘왔음. 그러나 물온도 조절이 잘안되고 칫솔도 유료라 아쉬웠음.'], [4, '전반적으로 시설이 오래되서 안타깝지만(TV, 콘센트 위치 및 갯수, 샤워실 시설 등) 그래도 침대도 푹신하고 가성비 있게 잘 묵었습니다\n(화장실 바깥문, 안쪽문 모두 빗살형태라 대소변 방음이 잘 안되네요)'], [5, '최고에요']]"
