카페명,분류,주소,별점,별점페이지,별점갯수,리뷰
코자호텔,"여관,모텔",제주특별자치도 서귀포시 대정읍 최남단해안로 44,4.0,https://place.map.kakao.com/1354860770#comment,24,"[[5, '꼭 모슬포항 가세요.. 최곱니다.. 진짜 사장님 너무 친절하세요~~ '], [4, '깨끗해요.\n제주 간다면 또다시 가요!!!'], [5, '가성비.진짜. 최고 \n방도 넓고 무엇보다 해수 스파가 짱이에요\n물이 엄청 좋고 몸이 보들보들합니다\n오래된 시설이지만 청소 깨끗하게 해주시고 3연박이었는데도 시트.매일.교환해주시고\n매일매일 해수탕에 담그니 부모님이 정말 좋아하셨어요\n가족이나 어르신들 여행에 적합한 숙소입니다.'], [5, '흐린 날씨였지만 숙소에서 찍음\n아들과의 여행\n넓고 깨끗한 내부\n스파도 최고\n주변 마트 시장 식당\n모두 만족합니다\n잘 쉬다 갑니다'], [5, '가성비 최고의 숙소입니다.\n깨끗하고 친절하고 위치도 좋고 \n해수스파도 좋고 바닥난방도 좋습니다.\n시스템 에어컨도 좋더라구요.\n3만보를 넘게 걷고 3시간 가량 이동해서\n무지 피곤했는데 해수스파와 바닥난방으로\n하루의 피로를 풀 수 있었습니다.\n\n담배 냄새도 전혀 없어요.\n참고로 비흡연자 입니다.\n\n안좋은 후기들 있어서 \n검색을 엄청나게 했었는데\n그 시간들이 아깝네요.\n\n모슬포에 가면 다음에 또 이용할 거예요.\n\n'], [5, '스파에서 바닷물 나옴 사장님 친절하시고 깨끗함 컨디션 최상 담배냄새 안 남. 금연객실. 물론 난 흡연자'], [5, ''], [5, '올 봄에 이어 두번째 방문인데 역시 만족스럽습니다.\n고급호텔은 아니지만 세심한 세면용품들과 생수 두 병, 맥심커피 두 개 ...\n오자마자 욕조에 물받아 사우나하듯 따끈하게 자꾸지를 사용했더니 피로가 풀리네요.\n방도 적당히 쾌적한 사이즈에 적정한 요금, 넓은 주차장, 아래엔 투썸플레이스~\n들어올 때 출입문에 만실이라고 붙어있네요...'], [3, ''], [2, '가성비 치고는 벌레 3종 잡느라 괴로웠습니다. 해수 나오는건 좋은데 욕조가 약간 내려 앉았고, 객실이 전체적으로 습하고 약간 퀴퀴한 냄새가 났어요. 이불에서도 뭔가 바다냄새 나고 수건 컨디션도 좋지 못했습니다. 아쉬워요.'], [5, '전혀 기대를 안 하고 갔었는데 방이 광할하게 넓고 침대도 크고 화장실고 넓어서 놀랐던 게 생각나네요. 여기 방에 있는 의자가 상당히 고급스럽고 편합니다. 제주도 어딜 가도 그 정도로 좋은 의자 못 봤네요. 더블 + 싱글 방에서는 여섯 명도 잘 수 있을 정도로 넓고 신축 건물이라 모든 게 깨끗합니다. 여기 있다가 아트스테이 같은 곳 가니까 여기가 그립더군요. 가성비 최고입니다.(2018년 4월)'], [5, '너무 만족해요!\n일단 욕실이 넓어서 춤을 춰도 될 정도 \n주인분도 친절하고\n이 가격대면 비즈니스 호텔이나 1인실 게하를 가게 될텐데 여기가 훨씬 쾌적하고 좋습니다\n담에 또 올거애요'], [3, '호텔스 닷컴에서는 95000원 직접오니 65000 원  뭐가 어찌되는지?  바가지인가  65000원  치곤  그냥 괜찮고 95000치곤 기대 이하임'], [5, '처음에 담배냄새랑 모텔냄새나 나지만~ 창문이 있어서 환기 잠깐 시끼면 됨 들어갈때 잠깐 그러지 괜춘함\n딱 그거 빼보 다 좋음 가격좋코 침대도 넓고 개인 욕실 마음듬ㅋㅋ'], [4, '방 처음들어갈때 담배냄새 은은?하게 나고\n침대에서도 은은?하게 담배냄새나요\n근데 이불 배개 침대에 코대고 맡으면 담배냄새 나진않아요 어디에서 나는건지..궁금\n테이블이랑 의자 바닥 다깨끗합니다.\n테이블은 물티슈로 닦았는데도 먼지안나오더라구요\n욕조, 화장실도 깨끗해요 욕조미끌거리지도 않았구요\n냄새에 별로 안민감하신분들은 만족스럽게 지내다 갈듯하고 저처럼 조금 예민하면 은은한 담배냄새 느끼실수있습니다'], [1, '하...깨끗하지 않고 담배냄세 많이나고 찜찜해서 그냥 나왔어요.'], [5, '두명이라서 트윈으로 신청했는데 하나는 더블 하나는 싱글이라서 셋이 가도 충분할듯해요 저렴하고 깨끗하고 넓어요 가파도 가는 항구도 가깝고 근처도 조용하고 좋아요'], [4, '가격대비 및 타 숙박시설과의 부대시설 비교 시 만족...(어떤 곳은 화장대 의자도 식탁 및 의자도 없음)'], [4, '깔끔하고 쾌적합니다.\n다만 살짝 시설이 아쉬운 느낌은 있지만 위치가 꽤 좋습니다'], [5, '여기만큼 싸고 좋은데 못봤습니다\n집사람  딸래미  너무 좋아합니다\n왠만한 국내 온천보다 물좋습니다'], [3, '스파는 만족!!! 침대가 2명자기에 좀 작네요.'], [4, '방깔끔하고 해수스파 존좋\n근데 정해진시간에만 틀라고 적혀있음에도 불구하고 밤에 이용하는 똥통들이 문제임\n밤에 스파소음있음']]"
아인스호스텔,"여관,모텔",제주특별자치도 서귀포시 태평로 432,4.0,https://place.map.kakao.com/26596736#comment,17,"[[1, '가격만큼 이라고 생각하려고했는데,인간적으로\n침대매트리스 너무 안좋아요\n이불은 너무 무겁고 더워요\n다시는 저렴한 호텔,모텔 안다닌다고 다짐하는 밤'], [4, '가성비가 최고인 호텔인것 같습니다. \n조금 년식이된 곳이지만 침구도 깨끗하고 욕실도 깨끗하게 유지하고 있어요.'], [5, '친절하고 뷰&hellip;&hellip;엄청좋아요'], [3, '샤워 가운 없고 지급해준 생수 다 마시면 물을 더 받을 수도 없고 어디서 떠 마실 곳도 없어요. 정수기 이용 안 되고 물 더 못준다고 하더라고요. 그리고 조식은 전복죽이 있어서 괜찮긴 한데 그래도 좀.. 돈 아까운 것 같아요. 주변에 생각보다 아침 식사 여는 식당 있으니 차라리 식당에서 먹는게 좋은 것 같아요.'], [4, '위치 좋음. 올레시장 걸어서 가능, 천지연, 세연교 등 가깝고, 걸어서 서귀포항 갈수있음. 객실 깔끔하고 트윈룸에 베드 하나는 싱글, 또 하나는 더블이라 편하게 이용했어요. 조식 식당 뷰 좋고, 전복죽이랑 빵, 시리얼 등 간단하지만 괜찮은 편. '], [4, '직원들이 아주 친절하고 깨끗해요. 가성비 좋습니다. 주차장이 좁아서 발렛도 해주시더라구요. 다만 저렴한 가격때문인지 기본으로 비치된 물(3개) 외에 추가로 더 받을 수 없었고, 비품들이 오래되어보였습니다. 그래도 뭐 가격을 생각하면 그러려니 하게되는 수준..?'], [3, '호텔위치와 방 사이즈등 가격대비 좋습니다. 그런대 한가지 침대가 바꿀때가 지난것 같습니다. 지금까지 가성비호텔 위주로 다니면서 침대에 불만을 가져본적은 첨인것같네요. 침대만 교체한다면 상당히 좋은호텔인것같습니다.'], [4, '다 좋은데 매트리스가 딱딱해서 별 하나 빼요 ㅎ '], [5, '하나는 3층하나는 7층에서 찍은 오션뷰 객실사진이에요. 직원들 친절하시구 방깨끗합니다. 그래서 원래는 이틀만하려고 이용하려고했는데 서귀포에있던 4일내내 이용했어요. 추천드립니다. 주차도 발렛해줍니다.\n'], [5, '너무 좋아요 매번 이용 중!'], [1, '주차장이 많이 좁아요. 샤워실 온수조절이 고장나서 방을 바꿔주셨는데 바꿔주신 방은 찻길로 난 창문이 닫히질 않고, 화장실 하수구에는 담배재가 떨어져있었고, 머리카락도 곳곳에 있었습니다. 또 바꾸기 너무 피곤해서 &ldquo;싸니까..&rdquo;라고 합리화하고 그냥 잤습니다. 체크아웃 때 사진과 함께 방 컨디션을 말씀 드렸는데 &ldquo;아...&rdquo; 만 하시고 사과 한 마디 없으셨습니다.'], [4, '직원들이 너무 친절해요 위치도 좋은데 다만 주차하는 공간이 너무 좁아요 방은 너무 깨끗하고 좋은데 방음이 잘 안 됐어요 ㅠㅠ 위층에 좀 시그러웠어요 근데 가성비 최고예요 참고하세요^^'], [5, '편하게 잘 자고가요^^'], [5, '친절 깨끗... 가성비 짱!!'], [5, '가성비 최고 '], [5, '훌륭해요. '], [5, '저한테 딱 걸리셨어요.\n\n어디하나 마음에 안드는 구석이 없네요 :-).\n\n위치,발레파킹,가격,청결도,깨끗한 침구,커다란tv,어메니티,넓은 객실,조식(전복죽맛집),직원분들의 친절함\n완벽하네요 정말 :-0.\n\n너무나도 기분좋은 마무리와 시작이었어요 ;-).\n진짜 정말 ']]"
아라팰리스호텔,"여관,모텔",제주특별자치도 제주시 남성로26길 26,3.8,https://place.map.kakao.com/1218668479#comment,6,"[[2, '제가 제주도는 출장이 얼마없어 평가가 맞는지는 모르겠습니다만 일단 비대면에 예약제로 운영하시는것 같아요.\n칫솔은 따로 구매해야하며 일반적으로 주시는 세면세트는 없내요.\n쓰레기는 숙박자가 분리수거해서 치워야해요.\n방은 깨끗합니다. 원룸 같은 방이구요.\n출장이 많은 저는 조금 불편했습니다.\n'], [1, '애초에 무인 체크인체크아웃이 굉장히 위험하다고 생각합니다.. 게다가 관광지에서.. 생각이짧으신듯'], [5, '너무 좋았어요! 친절하시고 관리 너무 잘되어 있어요 짱짱\n다음에 오면 꼭 다시올게요!'], [5, '침대시트에서 세제냄새 나요..! 바닥에 머리카락 한 올도 없고ㅜㅜ 이렇게 깨끗한 숙소 처음 보고 가용ㅎㅎ 다음에 제주시에 또 놀러오면 다시 방문할게요'], [5, '깔끔하고 호스트님도 친절하시고 편안히 묵었어요'], [5, '숙소가 너무 깨끗하고 관리가 잘되어있어요 그리고 숙소에서 창밖을 보면 제주바다와 제주시내가 \n발아래 한눈에 놓여있어 전경이 시원한게 너무 좋았고 아침에 호텔앞 산지천을 따라 제주시내를 \n가로지르는 계곡의 졀경을 산책하며 인근의 동문시장까지 쇼핑할수 있어서 좋았어요\n그리고 호텔주변에 동문시장,관덕정,삼성혈,국수문화거리,제주자연사박물관,산지천,,,,   편하게 관광\n하였고 교통이 너무 편해서 좋았어요']]"
대동호텔,"여관,모텔",제주특별자치도 제주시 관덕로15길 6,4.2,https://place.map.kakao.com/8303171#comment,16,"[[5, '소문그대로 50년이상된 달리 생각하면 보존 값어치가 있는 곳이에요. 레트로 느낌을 원하시는 사람들은 일부러 찾는곳!! 1대 사장님하고 2대사장님 어머님과 딸이라시네요.\n너무 친절하세요.청소도 잘 되어 있구요. 동문야시장을 원하시면 바로 코앞이라 편하딥니다. 사장님 잘 쉬다갑니다. 아이셋 가족이에요 ㅎㅎ 번찬하세요~~'], [5, '깨끗하고 친철합니다. 근처에 다시 오게된다면 또 오고 싶어요'], [2, ""새벽 4시10분.\n ᆢ나는 지금 깨어있다.\n 30분마다 소음을 반복적으로 쏟아내는 오래된 소형냉장고의 발악같은 기계음에 '잠자기'를 포기했다.\n어는 후기에서 보았던 냉장고의 기계음으로 잠을못잤다는..하필 재수없게 그 방이 걸린건지, 모든방이 그런건지..구형 냉장고의 반복적인 기계음에 익숙해지지 못하는 내 탓이겠지.\n누굴  탓하겠는가.  어서빨리 제주도 여행의 첫날밤이 지나가길 기다린다. 뜬 눈으로. ""], [5, ''], [5, ''], [5, '오래된곳 맞습니다.근데 뭔가 고풍스럽달까?객실에 들어가면 얼마나 쓸고닦았을지 느낌이옵니다.특히 흡연자분들 3층 예약하세요.가보시면 압니다.'], [4, '제주동문시장 큰길 건너 바로 앞! 위치는 아주 좋음. 호텔이라는데 호텔 맞나요?\n방바닥은 따뜻한데 방공기는 썰렁.. 친절하고~ 옛날 할머니댁 놀러간 느낌의 호텔 ~ 하룻밤 잘 쉬다 갑니다'], [2, '누가 후기를 좋게 써놨냐.... 깨끗한건 조았는데 방음은 최악 '], [3, '후기 좋아서 방문..오래됐지만 관리에 신경 많이 쓰는듯함 하지만 가격 정도의 수준이였고 난 그냥 그랬음'], [4, '레트로호텔.프론트에 연세좀드신분이 계셨는데 호텔이랑 웬지 이미지가 딱인듯.오히려 젊으신분이 계셨다면 뭔가 좀 어색했을듯ㅋㅋ별하나 뺀이유는 테라스가 개인이아니라 공동이라서 좀 아쉬웠음.문단속하느라 신경쓰였음.'], [5, '매년 제주에 두세번 이상 다녀오는데 일정 마지막날은 꼭 이곳에서 숙박합니다. 연식이 오래되어 다소 세월의 흔적이 느껴지지만 깔끔하게 관리가 잘 되어있고, 사장님 내외분이 친절하십니다. 동문시장, 칠성로, 관덕정, 탑동광장 등이 아주 가깝습니다.'], [5, '오래된 역사가 있는  전통있는 곳으로\n깔끔하고  친절한  다음에도 제주에 오면 찾고 싶은 고향집 같은 그런곳입니다\n제주 찾는분들께 강추합니다\n물론 숙박비도 저렴하구요^^'], [5, '레트로 디테일 끝판왕! 청결한건 또 현대식이라서 더 좋았어요'], [4, ''], [4, '다시 가고싶어요~~친절하고.. 깨끗하고..  동문시장근처 교통 편리합니다. 감사~~'], [4, '오래된 호텔이지만 깨끗하고 아늑한 분위기가 좋아요. 근데 갈때마다 침대가 너무 불편해서 딱 그게 단점입니다. ']]"
시티홀호텔,"여관,모텔",제주특별자치도 제주시 동광로4길 9-4,3.5,https://place.map.kakao.com/1819466547#comment,4,"[[1, '카운터여자 손님태하는태도가 0점\n객실바꿔달라니까 따지듯 말함'], [4, '위치좋은편이고 전반적으로 깔끔 무난합니다 친절하시고 삼다수도 주셔서 좋았고요 갠적으로 베개시트랑 변기빼곤 만족'], [4, '깨끗하고 좋습니다.\n단지 새벽에 너무 추웠어요.\n근처 맛집들 엄청납니다.'], [5, '우연히 선택하게 됬는데 1년정도된 숙소라 아~주 깨끗하고 조용하고 좋으네요. 사장님부부도 젊은 분들이 정직하고 올곧은 인상^^ 다음에도 제주 오면 여기로 와야겠네요. 진심으로 추천합니다']]"
오라스테이,"여관,모텔",제주특별자치도 제주시 무근성길 44,4.0,https://place.map.kakao.com/1926642249#comment,15,"[[5, '나는 완전 가성비 갑! 위생도 좋음.\n돈 값하는곳'], [1, '잘 쉬고 있었는데 머리위로 갑자기 전등이 떨어졌어요....^^... 이런 경험은 정말 처음이라 놀랐어요... 떨어지는 전등에 머리를 박았는데 그나마 피해서 크게다치진 않았지만 밤새 놀란 가슴으로 잠을 제대로 자지 못했어요 그래서 날이 새자마자 체크아웃 했습니다. \n주인분께서는 제가 머리를 박았다고 했는데도 제가 별로 안다쳐서 다행이라고 생각하신건지 \n방을 바꿔주신다는 말과 함께 그냥 제가 느끼기엔 조금 건조하게 죄송하다는 말뿐이라 조금 기분은 상했지만 좋게좋게 여행 온거라 그냥 돌아 갔습니다. 하지만 다른 숙소를 갈 때에도 트라우마처럼 전등 밑에는 앉지 않을 것 같네요...'], [2, '침대매트리스 스프링이 다 느껴질 정도였음 그래서 허리가 넘 아프고 침대 엄청 흔들거림\n내가 간 방은 테레비도 안나왔음 파란화면만 계속뜨고 아무리 리모컨 만져봐도 안나왓음\n그래서 별점 2개줌 &gt;&lt;'], [5, '직원분들 친절하고 좋았어요.\n시설은 가성비 생각하면 5점 만점이고,\n시내 가까워서 이곳저곳 다니기 편합니다.\n잘 쉬다가 갑니다.'], [4, '가성비.진짜.짱\n방.화장실 둘다 깨끗하고 좋아요 \n단점은.화장실에서 하수구냄새가 마니 올라오는데 방이 문이 따로 화장실이랑 완전 분리되어있어서 문닫아 두면.방에서는 냄새.안나요 \n씻을 때만 숨 좀 참으면.됨 \n'], [5, '숙소도 깨끗하고요, 조용하고 좋습니다.\n난방도 잘 되고요 Tv,냉장고도 있네요. 가성비도 좋구요\n다음에 혼자 와도 전 여기 올래요\n단, 안타까운건 주차 안되요ㅜㅜ '], [5, '혼자 제주도를 자주 방문했는데, 여긴 처음 가본 숙소였어요, 밑에 분 평가대로 가성비 갑입니다. 공항 및 동문시장근처 숙소 잡으실분, 참고하시고. 참고로 화장실마져.. 사진처럼 깨끗합니다. '], [4, '조용하고 깨끗했어요.'], [5, '가성비 굳, 다음에 또 혼자 제주도 오게 된다면 재방문 의사 있음'], [3, '그냥 보통 입니다'], [1, '가성비가 좋아서 예약했는데 이불을 걷어보니 시트위에 머리카락 다리털이 몇개 있었음.\n근데 다음날도 그대로... 이건 시트를 교체하지 않는다는거겠죠ㅠㅠ 찝찝해서 이불 안 덥고 잠ㅠㅠ'], [5, '룸컨디션 굿. 공항근처 싸게 하루 묵기 딱!\n골목안 약간 으슥~ '], [5, '동문시장과 가깝고 리모델링해서 내부가 깔끔해요  주인분도 친절해서 잘있다갑니다'], [5, '최금 리모델링 한 모양. 시설 청결 침구 모든면에서 최고. 주차만 해결되면 이렇게 쌀 이유가 없음'], [5, '시설, 가격, 위치(공항, 탑동,  칠성로, 지하상가, 동문시장,야시장 등) 아주 좋네요. ']]"
아루미호텔 협재점,"여관,모텔",제주특별자치도 제주시 한림읍 한림로 545,3.5,https://place.map.kakao.com/42918831#comment,4,"[[3, '성수기에 1박 10만원으로 숙박\n해변과 거리가 조금 있지만\n숙소 컨디션은 나름 만족'], [5, '룸&amp;시설컨디션은 제주에서 제일 좋습니다\n럭셔리는아니고 딱 비지니스 느낌이지만\n깨끗하고 새것이라 맘에듬'], [5, ''], [1, ""'호텔 흉내내는 모텔?? / 비즈니스 호텔??'\n\n수건에 안빨린 빨간국물 or 검은 부스러기\n\n나는 짧은머리 남자임, 테이블 한가운데 여자머리카락 떡하니 올려져 있음\n\n사진은 없지만 새수건 사이에서 정체불명의 핑크색빗이 툭 떨어짐 \n\n층간/벽간소음 심함\n\n그 외 집기들 드라이기, 포트, 리필샴푸 등 모두 모텔급(특히 샴푸향이 정말 제일 싸구려 대용량리필 샴푸 딱 그거의 향)""]]"
호텔G,"여관,모텔",제주특별자치도 제주시 남성로 117,3.5,https://place.map.kakao.com/22405136#comment,13,"[[2, '여기 \n5성급 호텔이다\n추천 한다 진심으로\n'], [1, '알수없는 진동으로 귀가 먹었습니다.\n'], [5, '가성비가 조아요'], [4, '제주 호텔모텔 다 합쳐서 가성비 최고인 것 같아요ㅠㅠㅠ저는 숙박업소에 있어 아주 예민하지도 둔감하지도 않은 사람이에요! 이번 여행 짠내투어 느낌이었어서 저렴한 숙박에 있어 큰 기대 안 했는데 건물 앞 도착하자마자 모텔이라기엔 호텔느낌도 느껴져서 기분 좋았고, 사장님도 친절하셔서 좋았어요♡♡ 저한테는 크게 때 끼거나 막 머리카락이나 모래 같은 것도 안보이고 (그런 거 굳이 찾아보지 않는 스타일.. 사람이 하는 거라 만약 발견했어도 그러려니 넘기려고 하는 편) 이불도 안 찝찝하고 깨끗하다고 느껴졌어요. 수건에선 조금 모텔냄새가 나지만 건물 전체에서 향기가 나요! 아마 신식건물이 아닌만큼 냄새에 신경쓰시는 게 아닐까 싶었습니다ㅎㅎ 대신 그래서인지 배달음식은 피자, 치킨 외 반입 불가하다고 쓰여있었어요! 아 물론 자세히 냄새를 맡으면 건물냄새가 날 순 있겠지만.. \n추위 많이 타는데 방 적당히 따뜻하고, 아 맞다! 방이 되게 넓어요 웬만한 3성호텔보다 넓은 듯...? 위치도 너무너무 좋고 유일한 단점인 모텔 키!(호텔이라고 쓰여진 긴 막대기가 붙어있는 키를 들고다녀야 함)를 제외하고는 모든 단점을 감안하고서라도 최고의 모텔이었어요. 공항도 제주시내, 동문시장 등 다 넘 가까워용 다음에 또 오고 싶어요❤ 여기 3박 연박하길 잘 했어요♡.♡ \n정보를 더 드리자면 침대는 푹신보다는 딱딱한 편인데 허리가 배길정도는 아니구요(너무 푹신하면 오히려 다음날 힘듦..) 퀸사이즈 정도 되는 넓은 크기예요! 콘센트는 두 개 정도 꼽을 수 있는데 침대랑 거리가 있어요. 침대 위 콘센트는 에어컨용이라 여름엔 사용하기 어려울 것 같아요! 그마저도 충전기 꽂으려면 각티슈 위에 휴대폰 올려야 해요. 샴푸린스겸용이랑 바디워시 있는데 따로 챙겨오면 좋을 것 같구, 칫솔이랑 치약 있어요! 칫솔 미세모 아니고 튼튼모라서 치석 제거 잘 돼서 좋더라구요 ㅎㅎ 수건 네 개 있었구 연박 시 물 2병씩 매일 주세요 제가 조아하는 제주 핑크물♡\n두 명이 평일 만오천원 정도에 이런 숙박 너무 감동....ㅠㅅㅠ 후기를 잘 파악하는 후기주의자로서 여기 고른 제 자신이 자랑스럽습니다.. 필요 이상으로 예민한 분 아니라면 여기가 분명히 마음에 드실 거예요 !\n\n+) 그 필요이상으로 예민한 게 저였네요.. 먼지 알레르기 있는 분 오지 마세요ㅠㅠㅠㅜ 이불 베개에 먼지 많아서 알레르기로 고생중입니다아... 알레르기 약 먹고 좀 나아졌움'], [1, '코로나시절에 배달음식도못먹는곳 입니다. 알려주지도 않으면서 다 써놓고 알렸다면서 정말 기분상하게 하네요. 여기가 호텔?이지모텔이라면 말하는데 것참. . 갑질이 ㅡ.ㅡ 여행와서 좀아닌것같네요. '], [3, '제주 공항 근처로 버스도 많고 가까워서 택시 이용에도 부담 없는 거리의 가성비 숙소이다.\n주자장은 2대 세울 수 있는 호텔 주차장(매우 협소) 외에 무료로 주차가능한 공용주차장이 근처에 있었다.\n\n주인 내외분이 친절하셔서 좋았다.\n구식 건물이긴 한데 매일 청소해서 깨끗했다.\n\n테이블이나 의자가 없는 게 아쉬웠다.\n침대는 깨끗한 침구였다.\n충전할 수 있는 콘센트가 3구짜리 하나인데 TV 밑에만 있어서 충전하면서 핸드폰을 볼 수 없어서 아쉬웠다.\n\n에어컨 내부에 곰팡이가 있어 청소 부탁하니 저녁에 들어왔을때 내부쪽에 곰팡이는 싹 닦여 있었다.\n필터 청소도 부탁할 걸 까먹고 말씀 못드렸더니 에어컨 틀면 곰팡내가 나긴 했다. ㅠㅠ\n말씀드리면 해주실 듯 하다. 청소하는 분이 따로 계셔서..\n에어컨 소음은 심한편이라 새벽에 잘때 끄고 잤다.\n\n욕실은 리모델링 되어 있어 새것이라 깨끗했다.\n샤워젤, 샴푸, 일회용 치약2개, 슬리퍼, 수건 2장, 샤워타월 등이 있다.\n일회용 치약2개, 칫솔2개, 수건 4장, 물2병은 매일 새로 채워져있다.\n 화장대에 일회용 칫솔 2개, 일회용 면도기, 여분 수건 2장, 전기포트, 컵2개, 스킨, 로션, 갑티슈, 헤어드라이어가 있고 아래 냉장고에 물 2병이 매일 들어 있다.\n\n창문 닫으면 되긴 하는데 에어컨 소리때문에 끄고 자면 습해서 환기하고 자야 한다.\n조롱이가 건너편 아파트에서 새벽 5시 반부터 6시 14분까지 울어댔다..\n새 매니아라면 한번쯤 여기 묵는 것도 좋을 듯 하다.\n에어컨 필터 청소만 부탁하면 창문 따로 열 필요는 없을 듯 하다.\n주인분들 친절하시고 청소도 잘 되어서 괜찮았다.\n\n(WIFI, 금연룸) 욕실&bull;샴푸, 샤워젤, 비누, 샤워타월, 일회용 치약2, 일회용 칫솔2, 일회용 면도기&bull;1일마다 타월 (4장), 화장지 (1개)&bull;에어컨&bull;TV&bull;냉장고&bull;전화기&bull;전기 포트, 컵2&bull;헤어드라이어&bull;침대&bull;남성용 스킨, 로션&bull;갑티슈&bull;엘리베이터&bull;생수 2병(매일 지급)&bull;키'], [5, '깨끗한 호텔 좋아용'], [5, '좋았어요.\n저렴하고 깨끗하고'], [4, '오래된 느낌이지만 방은 청소가 잘되어서 아주 깨끗합니다.\n다마, 콘센트가 많이 부족하니 카메라, 스마트워치, 무선이어폰 등 전자기기 많으신 분들은 멀티탭 챙겨오시면 좋을듯 합니다'], [1, '말 많고  친절하지 않음'], [5, '깨끗하게\n관리해주심\n위치가좋아여\n저렴하구친절하심'], [5, '가성비가 좋은곳이에요 :) 위치는 관광객들에게는 좋지만\n도민뚜벅이한테는 살짝 애매했어요 객실 깔끔하고 좋았어요ㅎㅎ'], [4, '1박요금이 6만뭔이면 지낼만 하고 괜찮은 수준입니다']]"
