카페명,분류,주소,별점,별점페이지,별점갯수,리뷰
성산아쿠아비치호텔,"여관,모텔",제주특별자치도 서귀포시 성산읍 일주동로 4258,3.5,https://place.map.kakao.com/23679604#comment,14,"[[3, '2인 실에 3~4명이 자도 될 정도로 방 엄청 커 가성비 좋음\n실내화 없음.  노후화 수압 약함'], [4, '저는 가격대비 룸컨디션 좋다고 생각합니다\n좋았어요\n\n'], [5, '이 가격이면 그냥저냥 괜찮다 보는데.....\n뭐 더러운 방 걸린분도 있을 수는 있겠지만 성산쪽이 서귀포쪽 보단 호텔 경쟁력이 좀 떨어지죠\n하루 자고 가긴 괜찮습니다. 전화받은 젊은 남자분은 엄청 친절하셨고 카운터 계신 아주머니는 약간 화가 차 있었음..ㅋ\n참..방이 엄청 큽니다..방에 흑백 인물 포스터는 없앴으면 좋겠네..'], [1, '너무불친절합니다\n잘생각하여 예약하세요'], [1, '최악입니다....'], [3, '1점... 넓다. 주차장이\n1점... 싸다. 호텔인데\n1점... 없다. 스트레스 받을 일은\n\n그런데 수건들의 출처는?\n무슨 교회, 무슨 병원...'], [1, '그러지마세요. 조금더 투자해서 다른데 가세요. \n하~~제발 제발'], [1, '3만원에 예약했는데 3만원도 아까운 수준..\n샴푸통 물때에... 비누며 치약까지 사용흔적들이 너무 심해요.. 더러움'], [5, '특급호텔 생각지 않음 가성비 굿입니다.\n올레 걷고 있는데 제주에서 쇠소깍까지 8박 동안 잘 쉬고 갑니다.\n\n특히 여사장님이 무지 친절하시고 조식도 휼륭합니다.'], [5, '실용적인 호텔로써 성산주변 관광하기가좋코 특히 아침일찍성산일출과 광치기해변구경과 사진 찍기\n좋은위치입니다.특히 조식은 정성스런 상차림으로 맛도좋아요.여사징님도 편안하고 친절하십니다. '], [5, '말도안되게 좋음\n강추'], [5, '급하게 잡은 숙소인데 너무 친절하게 해주시고 방도 맘에들었고 따뜻하게 잘 자고 왔어요 다음에도 또 이용할듯'], [5, '가성비! 여름엔 빈 방 찾기 힘들듯'], [5, '']]"
메종드씨엘하버39 호텔앤리조트,"여관,모텔",제주특별자치도 서귀포시 천지연로 39,4.0,https://place.map.kakao.com/1745701238#comment,2,"[[5, '객실 널찍하고 침대 퀸사이즈 두개 들어있어요. 이부자리 뽀송하고 고급지고요 화장실 욕실 따로 분리되어 있어요\n샤워기 두 개라 너무 좋아요 \n뷰도 넘사벽이구요 카페도 전망 좋습니다 \n주변에 맛집 많구요\n관광지 가기도 편리하고\n산책 코스가 잘 되어 있습니다\n다음에 또 오고 싶어요 ~~~^^'], [3, '']]"
제주R호텔,"여관,모텔",제주특별자치도 제주시 서광로14길 5,4.0,https://place.map.kakao.com/22676688#comment,10,"[[5, '저희 부부는 대 만족입니다\n가격대비 가성비 좋구요 \n건물이 좀 낡기는 했지만 침구 깨끗하고 뽀송뽀송했어요\n1박하고 한라산 다녀왔는데 사장님 배려로 짐도 보관할수 있었고 또 약간의 추가금액 지불하고 샤워도 할수있었어요\n샤워가 젤 고민이였거든요\n비행기를 바로 타야해서요\n참 생수도 500원에 판매하셔서 냉동실에 얼렸다가 가지고 갈수있었습니다\n저희 부부는 다음에도 제주 가면 고민없이 또 방문할게요\n사장님 감사합니다~~^^'], [5, '터미널 주변이라 교통 편리, 저렴한 가격에 객실이 깨끗해서 참 좋았습니다.\n\n보기드문 가성비 숙소라고 생각합니다! 재방문의사 있습니다.'], [5, '제주R호텔 정말 좋았어요.\n저는 한달에 한번씩 제주 내려오는 편인데 숙소 위치도 좋고 사장님도 직원분들도 정말 친절하셔서 마음에 들어요.\n가격이 너무 저렴한데 숙소도 깔끔...!\n숙소 냉장고에 약 두고 체크아웃 했는데 두고가셨다며 전화해주시고 보관까지 잘해주셨는데 너무감사했습니다.\n올레길이나 한라산등반 하실분들 시외버스터미널 근처 알호텔 강추해요~\n'], [5, '안녕하세요\n제주R호텔 관리자입니다.\n정확하게 cctv 녹화돼있음, 6시30분부터 전날 사전에 말도없이 냉장고에 음식물을 맘대로 꺼내서 드시면... 그러시면 않된다는 말밖에 한것없는직원을 마치폭력을 행사한것처럼 병원에 간다는 말...\n아무리 후기도 영향력있다지만 너무한거  아닌가요 \n우리직원도 누군가에 소중한 아들입니다.\n앞으로는 신중하게 생각해서 후기를 작성하면좋을것 같습니다 \n감사합니다'], [1, '아침 7시전기준 10분전에 계란 빵 꺼네먹었다고 시퍼렇게 젊은 운동한 머슬맨 알바에게 줘 터질번했네....   라면도 내거먹구 compensation 받지도 못하고..      한라산 가기도전에 이 앞 한국병원에 엠블런스타고살ㅣ갈뻔....'], [3, '일하시는분들 친절.\n조식 컵라면까지 구성.\n하지만  객실  공용공간 먼지가 많아\n청결위생관리에 주의가 많이 요구도보입니다.'], [1, '비추천!!! 세면대 막혀서 양치질 한 물도 잘 안내려감!!!\n \n청소 부실... 카운터 직원 서비스 정신 실종...\n\n여기어때 이용 후 후기 남겼더니 어찌된일인지 삭제됨!!!\n'], [5, '(4인男도미토리)아무런 생각없이 제주도 왔다가 밤에 갈 곳 없는 여행객이 쉬어갑니다.\n호텔과 겸임하고 있어서 청결은 방문해본 제주도 게스트하우스 중 최고 수준입니다. 인테리어도 잘 되어있었고 설명도 친절. 특히 조식이 7~8:30인데 빵이랑 죽 너무 맛있게 잘 먹었고, 스텝들도 친절하고 잘 응대해줘서 고마웠습니다. 입실마감시간이 22시지만 그 이후에 오신 (예약하신) 외국인관광객분들도 받아주셨습니다. 교통편도 너무 편리해서 아침에 바로 다음 목적지로 향할 수 있었습니다. 가격도 저렴해서 재방문의사100%!'], [5, '아저씨 개조아 너무착하세야 깔끔하고 죠아조아*_*']]"
트루엘레지던스,"여관,모텔",제주특별자치도 서귀포시 태평로371번길 18,4.2,https://place.map.kakao.com/1493579511#comment,5,"[[4, '서귀포 관광지 부근이라 \n위치는 괜찮아요\n\n장기투숙도 많은데..\n청소상태가 좀 아쉬워요'], [5, ''], [2, ''], [5, '새로 지어져서 깨끗하고 깔끔해요, 세탁기, 인덕션, 냉장고, 티비, 청소기, 에어컨, 밥솥 등등이 다 새거고 좋은 제품들로만 되어있어요. 원룸형 방이지만, 책상도 있고 식탁도 있고 넓어요. 드레스룸도 있어서 옷이랑 짐 보관하기 용이하고 관리가 잘되어있습니다. 장기투숙하기 좋아요.'], [5, '최신식이라 시설도 좋고,\n주변 교통도 편리한 곳에 위치해서\n덕분에 첫 제주 여행을 편안히 다녀왔습니다 ^^.']]"
마로호스텔,"여관,모텔",제주특별자치도 제주시 동광로21길 5,4.4,https://place.map.kakao.com/26634081#comment,7,"[[5, '저는 외관 낡은거는 딱히 신경안쓰였어요\n외관이 낡다고 생각도 안들었고..\n시내에 가거나 등산하거나 딱 중간에 위치해 있는 것 같아서 접근성도 좋고 나가는게 힘들지 않고 좋아요 이불 너무 좋고... 나중에 사장님한테 이불 어디꺼냐고 여쭤볼거에유 헤헤 원래 하루만 묵고 다른 곳 가려고 했는데 여기 너무 좋아서 하루 더 연장했더니 연박 할인도 받고 좋았어용♡'], [4, '5박 예약하고 이용중인데 가성비 최고예요!!!\n다만 방음 안되요 윗층이 밤늦도록 쿵쿵거리고\n온갖소음이 다들려서 사장님께 말씀드리니\n빠른 피드백해주셔서 좋았어요 (그후도 쿵쿵...하)\n편의점 바로 앞에 있어 좋아용'], [4, '건물은 오래 되어 방음은 잘 안되지만 제가 묵은 날 게스트 분들이 서로 조용조용 주의를 해주셔서 편하게 잘 묵고 갑니다. (엘레베이터 없음)\n가격대비 깨끗하고 좋았어요. 주변에 인제 핫플도 가까워서 도보로 편하게 이동했습니다. \n다음에도 시내에 볼일 있으면 이용할거에요. '], [4, '오래된 여관을 개조해서 외관이 낡았고\n엘베가 없는데\n룸 컨디션은 깔끔해서\n공항 근처에서 짧게 숙박하기 좋아요'], [5, '오래된건물이지만 깨끗합니다. 잘 이용하고 갑니다. '], [4, '벌레가 나왔는데 집주인 부부가 잡아주고 다른방으로 바꿔줬어요. 조식맛있어요!'], [5, '외관은 낡았지만 내부는 깔끔합니다!']]"
노형호텔,"여관,모텔",제주특별자치도 제주시 수덕1길 7,4.5,https://place.map.kakao.com/27439461#comment,4,"[[4, '가격도 적절하고 시설이나 일단 방이 넓어서 좋아요'], [5, '생각지도않았는데 완전 굳\n숙박은 깨끗, 깔끔, 편하고 뷰도 좋으면 👍'], [5, '옛날 호텔이지만 넓고 싸고 깨끗함 관리 열심히 한 티가나요'], [4, '방 넓고 가격 저렴하고 괜찮아요 내부 시설도 깨끗하구요!\n근데 테이블 서랍안에 누가 먹다 남기고 간 과자가 들어있었어요 이건 조금...! 그랬네요...'], [4, '후기가 안 좋아서 걱정했는데\n공항 가깝고 가격 싼 곳이 여기뿐이라 예약했어요.\n이름만 호텔인 모텔인줄 알았는데\n깔끔한 시설이네요\n3박은 다른데서 하고 마지막 날 머물렀는데 \n방에 들어오자마자 그냥 여기서 더 몇박할껄 하는 생각이 들었어요\n다음에 제주 오면 요기로 와야겠어요.']]"
호텔DK,"여관,모텔",제주특별자치도 서귀포시 중앙로54번길 12,3.8,https://place.map.kakao.com/339722112#comment,21,"[[4, ''], [3, '위치 좋아요\n호텔이지만 모텔과 호텔 그 사이..\n호텔의 서비스를 기대하시면 안돼요\n연박시 청소도 이야기 안하면 스킵할수있고 기본 비품도 달라고 요청해서 받았어요..\n그러나 세탁기가 구비되어서 잘 사용했습니다'], [4, '가성비오짐 근데 창문 안열리게 못질되어있어서 환기충 별점 -1 합니다'], [1, '선불결제 하고 갔는데 체크인 늦었다고 예약취소ㅎㅎㅎ\n\n(사진은 밤 12시 반에 황망히 로비에서 찍은 사진)\n\n트립닷컴 통해서 예약하고 갔습니다. 밤 11시 40분 쯤 도착했는데, 저희 예약이 취소되었다는거에요.\n\n직원 말 &ldquo;11시까지 체크인을 안하면 예약이 취소된다, 그리고 그 방은 조금 전에 다른 손님이 결제하고 들어가서 방이 없다. 요즘 노쇼가 많아서 체크인이 늦으면 예약이 취소될 수 있다&rdquo;\n\n아니, 후결제면 노쇼방지 차원에서 예약 취소할 수도 있는건 알겠는데, 선불로 2박 요금 다 결제하고 갔는데도 취소시켰네요. 심지어 전화도 한 번 안주고 바로 취소시킵니까?\n\n트립닷컴 통해 예약하니 전화번호가 없다고 하네요, 트립닷컴 고객센터에 전화하면 고객에게 연결해주는거 같긴하던데 그건 그렇다치고, 선결제했는데 왜 취소시켜요? 하고 물으니.. 여직원은 그냥 자기네가 보는 사이트에 그렇게 적혀있다고 한거라고 하고.. \n\n저희 예약바우처에는 11시 전에 체크인 안하면 취소된다 이런말도 전혀 없었습니다. 선결제면 손님이 오건 말건 놔둬도 그만 아닌가요? 주말도 아니고 평일 2박이었는데\n\n죄송하다는 말도 없고 그냥 환불해주겠다 이런 말만 하더군요. 이 밤에 어디 가서 자라는 말인가요? 라고 물어도 자기네는 만실이다.. 이런 말만 하고\n\n호텔 로비에 앉아서 30분 동안 주변 호텔에 수십통은 전화해봤습니다. 트립닷컴 고객센터에 항의했더니 몇군데 알아봐주긴 했는데 너무 멀어서 큰 도움은 안됐고요\n\n(그래도 오히려 외국계인 트립닷컴 응대가 훨씬 좋았습니다, 호텔 측에서 뭔가 문제가 있었던거 같아 죄송하다고. 오히려 호텔 직원들은 멀뚱멀뚱)\n\n직원들은, 다른 호텔에 수십통 전화하는 동안 왜 안가고 저기서 저러고 있나 하는 눈치더군요. 상급자 같은 매니저는, 무슨 일이야? 하고 여직원한테 조용히 묻고 아무런 말도 없고 저희는 없는 사람 취급ㅎㅎ\n\n결국 10km 정도 떨어진 다른 단골호텔 연락해보고 마지막 방 딱 하나 남았다고 해서 간신히 방 구해서 1시 넘어 체크인했습니다. 나갈때도 황당해서 쌩 나왔는데 아무 소리도 없더군요.\n\n다른 호텔 체크인하며 황당한 일 겪었다고 하소연했더니, 노쇼가 많아서 체크인 안하면 취소할 수도 있는데, 선결제까지 다했다고 하니까 많이 황당해하시더라구요\n\n가성비 호텔인 것은 알겠으나, 서비스는 기대마시고, 체크인 늦는 경우 반드시 사전연락하시길 바랍니다'], [3, '가성비 좋았구요~ \n어린여자직원은 별로...\n좀 아쉬윘다면 먼지가....'], [4, '위치가 정말 좋아요'], [1, '0.5개하고 싶은데....\n1개가 최소네요.......\n아무리 저렴하다지만......\n직원들의 서비스가 호텔가격 이하입니다\n지배인 같아보이는 분만 친절하시고\n20대 남녀직원분들........\n위치는 매우 좋습니다'], [5, '높은층일수록 이뻐요'], [5, '추천합니다 '], [5, '한라산뷰, 드럼세탁기, 전자렌지 구비, 서귀포 매일올레시장 바로 앞이라 주차 걱정도 없고 완전 강추합니다'], [4, '장점 : 가성비 굿 / 운좋으면 시티&amp;마운틴 뷰 / 위치 최고. 시장바로옆\n단점 : 방음 잘 안됨 ㅠㅡㅠ / 타워주차'], [4, ''], [5, '2020 08 10 투숙했습니다\n가성비 좋고  올레시장 가신다면 여기 묶으시라고 추천 드리고 싶습니다'], [5, ''], [5, '최고다'], [5, ''], [5, '별4개 정도 줄라 했는데\n올레시장 근처라 너무 편해서 별5개 줍니다\n\n올레시장에서 회를 사와서 \n옥상에서 먹으면 좋아요\n옥상에 식탁과 의자가 있어요\n\n호텔 옆 제주어묵도 사와서 \n룸에 있는 전자렌지에 데워먹었습니다\n제주어묵 맛있네요. 강추합니다.\n집에 갈때 사가야겠어요\n\n요즘 수도권에 새로지은 오피스텔 생각하시면 됩니다\n거기에 침구가 제법 좋아요\n방은 좀 작은편압니다. 모텔 수준... \n\n인조가죽 냄새(?) 그런거 안납니다\n방충망이 없다고? 그럴리가... \n방충망은 창문열고 위에서 잡아당기면 내려옵니다\n사용법을 모르고 모기에 물렸더고 평점테러를 하다니... 쯧\n\n드럼세탁기가 있어요\n세제는 프론트에서 1천원에 팝니다\n겨울옷은 건조가 2% 부족한데 빌트인이 원래 그래요\n건조대가 없어서 아쉽지만\n여기저기 널어 놓으면 밤새 잘 말라요\n\n시내에 우뚝 솟아 있어서 \n비교적 전망이 좋아요\n1106호에 묵었는데\n멀리 바다도 보입니다\n\n이 호텔에 평점 테러를 한 사람들은 \n평가 기준이 5성급 기준인 듯 \n5만원 내고 뭘 더 바라냐?\n저는 가성비 기준으로 평가했습니다'], [5, '605 방충망 유리 위 있있습니다 '], [1, '편의시설은 별로고 직원들도 별로고 룸은 인조가죽냄새 오지고 프론트도 위치도 그냥 이것저것 모두다 별로인 호텔임 '], [1, '참 이상하네요.  별 다섯개? 정말 피곤했는데 모기와의 전쟁을 치르다 잠도 못자고  ㅠㅠ  정말 속상해 죽겄네요.  5월 28일에 1007호에 묵었는데, 공기가 답답했어요. 문 닫아두어서 그런가싶어서 잠시 창문 열었다가 방충망이 없길래  바로 문 닫고 에어컨 틀었어요. 샤워하는데 신랑이 바퀴벌레를 잡았다고 변기에 버리더라구요. 다 씻고 자려고 누웠는데 잠을 잘수가 없는거예요. 불을 켰는데 벽에 모기 천지였어요. 모기  잡다가 더워서 에어컨 켰다가 아이가 추울거 같아서 껐다가 이건 방충망도 없어서 창문도 못 열고 잠도 못 자고 환장하겠더라구요. 아침에 \n어른은 물렸다치더라도,  아이 얼굴을 보니 다행히 이마에 한방 물렷기에 다음 일정 간다고 바삐 퇴실했습니다. \n그런데 그날 밤에 다른 숙소에 들어가서 씻기는데 발 쪽은 장난이 아니더라구요. 모기도 많이 물리고 바퀴도 물려서 혹보다도 더 크게 딱딱하게 부어올라서 계속 끌고, 에어컨 때문에 감기까지 걸렸어요. 요즘 모기 위험할수도 있는데, 모기 잡느라 설칠 시간에 프론트에 항의를 할걸 미련했어요. 다른 방은 괜챦은데 1007호만 이럴수 있나요? 왜이리 평이 좋은거죠? 평보고 갔는데 정말 속상해요.'], [5, '침대도편하고,드럼세탁기가 룸마다 있어서 넘편해요~\n호텔옥상에서 바라보는 경치도 넘멋있구요,\n호텔위치는  서귀포올레시장 서쪽입구에 위치해 있어서 간식거리며, 매식사  걱정필요없어요..게다가  주차걱정노!']]"
베누스무인텔,"여관,모텔",제주특별자치도 제주시 애월읍 유수암평화5길 92,5.0,https://place.map.kakao.com/19484787#comment,3,"[[5, '가성비갑. 와인무료, 아메리카노 무료, 안마의자, 넷플릭스, 스파욕조.. 4만 7천원 정도에 이 정도면 최고다.'], [5, '제주도 방문하면서 1박 숙소중 최고입니다..\n깨끗하고 안마의자에 안마침대 한라산등반하고 힘들었는데 완전 좋아요!!!!'], [5, '깨끗하고 조용하고 편안하게 쉴 수 있어요.\n휴식도 하고 러브도 하고 여기 진짜 짱인듯.']]"
메이플호텔,"여관,모텔",제주특별자치도 제주시 원노형3길 41,3.5,https://place.map.kakao.com/14757418#comment,2,"[[3, '제주시 쪽에는 저렴한 호텔,모텔중에 괜찮은 곳 찾기가 힘듬  메이플 호텔 1층에 주차공간있고  8대인가 10대정도 주차가능   엘리베이터 타고 내리면 킬라 냄새 심하고 방안에도  같은 냄새가 남 처음엔 킬라를 엄청 뿌렸나 했는데 방향제 같음 시간지나면 익숙해져서 냄새안남  방안은 생각했던거 보다 괜찮음  화장실도 그냥저냥 괜찮음  단점은 (베개 커버랑 수건 새거로 (전체) 교체했으면함 )베개 커버가 누리끼리함 반대로 뒤집어도 누리끼리함  찝찝   수건도 누리끼리  \n베개 커버랑 수건만 관리 잘해줘도  괜찮을듯  \n다음에도 이용할 생각은 있음  일회용 베개 커버 있음 가져가고 싶네'], [4, '저렴하게 할인 받아 이용할 땐 몰랐는데, 다음날 더 저렴한데 가니 이곳이 좋았던 걸 역체감한다.']]"
호텔탑아일랜드,"여관,모텔",제주특별자치도 제주시 용남1길 47,5.0,https://place.map.kakao.com/27319607#comment,2,"[[4, '깨끗한 곳. 오래 머물기엔 부족한 곳'], [5, '하룻밤 잘 묵었다 갑니다. 아이들이랑 스너쿨링하고 갑자기 잡은 숙소인데 잘 잡은거 같아요. 주차는 좁아서 조금 불편하긴 했어요. 근처 냇가가 있는데 옆으로 산책하면 넘 좋더라구요. 집들이 약간 올드한 분위기라서 넘 좋았어요~'], [5, '혼자 간 제주 일정! 너무 저렴하게 예약했는데 굳이 방을 업그레이드 해주셨습니다. 깔끔하고 깨끗한 이불~ 감사하게 잘 쉬고 왔습니다. 그리고, 남자사장님 비 오는 아침 카톡을 안하는 저 대신 택시도 불러주시고 진심 감사했습니다.. 담에 다시 갈게요~~번창하세요~']]"
르네상스호텔,"여관,모텔",제주특별자치도 제주시 서사로14길 1,5.0,https://place.map.kakao.com/8344108#comment,4,"[[5, '오만원 정도에 근처에 식당도 많아서 가성비 좋은 호텔이네요.\n친절, 위생, 주차 모두 이정도면 만족 !'], [5, '깨끗하고 아늑하고 저렴하기까지 !!! '], [5, '최근에 리모델링 됐나봐요\n와우! 완전깨끗. 침대푹신함!'], [5, '뭐가 0점을 주고 싶어요\n진짜 개개개 친절하심. 진짜 친절하시고\n방도 엄청 깔끔하고 좋아요.\n제주도에서 4인 가족 가성비 있게 너무 좋았습니다.\n마지막날 동문시장이랑 공항 가깝게 가실 분은 고민하지마시고 이쪽오세요.\n진짜 후회 안해요. 진짜 친절합니다요 진짜\n어머니 아부지께서도 제일 고급스럽다고 뭐라하시네요!!!!!!\n']]"
바다해호텔,"여관,모텔",제주특별자치도 서귀포시 천지연로 3-1,4.9,https://place.map.kakao.com/966213088#comment,8,"[[5, '깔끔하니 좋았어요~'], [5, '깔끔하고 좋았습니다! 사장님이 추천해주신 보물섬횟집도 맛있고 아주 좋았어요!!'], [5, '서귀포항 근처 깔끔하고 쾌적합니다'], [5, '아주 주아'], [5, '최고라고 생각합니다 \n가장 중요한것은 룸컨다션 오성급 호텔 저리가라 합니다\n\n전망 최고구요\n\n왜 아직 이런 속소가 안알려지는지 이해 안돼요\n\nㅡㅡㅡㅡㅡ절취선 ㅡㅡㅡㅡㅡㅡ\n\n3번째 다녀온 후기입니다 \n\n늘 쾌적한 침구\n층층마다있는 믹스(믹스 성애자) 뜨건물 상시 구비\n흡연자의 천국 ㅋ( 베란다에서 하세요 객실 노우)\n\n뷰는 에블바디 오마샤릐프 뷰\n\n밤에 바로 앞 잔디서 먹는 치맥(젊은이들이 많아요 늘)\n나이스 아닌감?\n\n아 예약하지 마세요 이젠 제가 할 수 없는 상황이 생길지.... 하지마세요 \n\n'], [5, '요즘 호텔이 서양식으로 신발벗는데랑 거실이 구분안돼있어 정말 난감할 때 많은데, 이곳은 우리한국식으로 돼 있어 좋았구요, 멋진 바다뷰도 즐길 수 있어 좋았어요.'], [5, '최고의 호텔 시설물 ok / 사장님 ok / 2021년 재방문.'], [4, '청결하고 저렴해서 좋아요. 섶섬 앞바다도 보이고 배란다가  \n있어 아름다운 경치 보면서 흡연도 할 수 있네요!']]"
신세계호텔,"여관,모텔",제주특별자치도 서귀포시 중앙로 2-2,3.9,https://place.map.kakao.com/13727441#comment,9,"[[3, '사장님이 친절하시고 칫솔포함한 세면키트를 무료로 제공해주어서 좋았습니다. 근처에 먹을 데도 많아서 더 좋았습니다.하지만 누벼진 오래된 이불과 화장실 곳곳에 녹슨 흔적이;; 가성비가 좋긴하지만 두 번 경험은 생각해볼듯;;'], [4, '저렴한 가격  좀 오래된 건물.\n친구끼리 오기에는 개안음.'], [5, '청소상태 깨끗. 이중섭미술관&bull; 올레시장 5분거리, 사장님 친절하고 피드백 빠름. 이 가격대 최고의 선택.'], [5, '방 컨디션 좋은 편이고, 친절하고,보일러 빵빵!\n수압짱! 온수짱! 침구류 뽀송합니다.\n천지연과 소정방폭포, 올레시장, 이중섭미술관을 모두 걸어서 다닐수있어서 위치도 좋습니다.\n그리고 무엇보다 뷰맛집이예요~!!\n서귀포바다가 보이고 섶섬이 보이고\n아침에 침대에서 일출을 볼수있어요^^\n가성비 좋은 호텔이에요.'], [4, '오래된시설이지만 침구도깨끗하고 화장실도 깨끗했어요 저렴한가격에 잘 자고 갑니다~ \n'], [4, '싼 맛에 잘만함. 가성비 좋음.'], [5, ''], [1, '위치는 괜찮았지만 청소를 안하는듯\n침대밑 썼던 휴지 깔림\n토할뻔'], [4, '이가격에 이정도면 훌륭해요. 서귀포 일박하기에 좋아요. 편의점 앞에 있고 빨래방도 바로 앞에. 맛집도 . 청결 친절 다 만족.']]"
늘송파크텔,"여관,모텔",제주특별자치도 제주시 원노형5길 22,3.7,https://place.map.kakao.com/10270124#comment,3,"[[4, '깔끔했음\n넷플릭스만 되도 좋앗을듯'], [2, '그냥  .. 두번은 안감'], [5, '2박하는데, 저렴하고, 깨끗하고 공항도 가깝고 좋아요']]"
호텔랑주,"여관,모텔",제주특별자치도 서귀포시 김정문화로27번길 23-3,4.3,https://place.map.kakao.com/20005271#comment,7,"[[5, '사장님 매우 친절하심 방 퀄리티에 비해 가격 매우 저렴한편 '], [5, '사장님 너무 친절하셨음^^\n청소도 깔끔하게 해주시고 청결도 굿~\n동부에서 묵었던 숙소와 차이가 너무 심했음..\n갑자기 또 생각나서 짜증...'], [5, '저번 여름에 묵고 갔는데 조용하고 편하니 좋았음. '], [1, '싼 숙박은 하는게 아니라는걸 이가게를 보고 결심을 굳히게됨'], [5, '&quot;가격대비&quot; 무척 깔끔. 무척 친절.\n\n'], [4, ''], [5, '최고에요^^']]"
에메랄드호텔에이스,"여관,모텔",제주특별자치도 제주시 오복5길 4,3.7,https://place.map.kakao.com/17274157#comment,3,"[[1, '물이 잘안나와요 그리고 건물 오래됐어 싫어요'], [5, '친절하시구 보일러도 따뜻하게 데워주셔요\n따뜻한 물 잘 나오구 침구도 청결합니다\n퇴실때 잠시 짐맡아달라구 부탁드렸는데 흔쾌히 맡아주셨어요'], [5, '저렴하고\n깨끗해서 좋아요']]"
